<?xml version="1.0" encoding="UTF-8"?>
<facturas xmlns:xsi="http://www.w3.org/2001/XMLSchema-instance" xsi:noNamespaceSchemaLocation="factura.xsd">
    <factura n_fact="n_27" fecha="2013-12-18" moneda="Euro">
        <datos-emisor>
            <nombre>Librería Pérez</nombre>
            <cif>44555666-B</cif>
            <telefono>777888999</telefono>
            <poblacion cod_postal="28043">Madrid</poblacion>
        </datos-emisor>
        <datos-cliente>
            <nombre>Biblioteca Padre Manuel</nombre>
            <cif>33111222-A</cif>
            <telefono>333999444</telefono>
            <poblacion cod_postal="29680">Estepona</poblacion>
        </datos-cliente>
        <detalle-factura importe="86.12">
            <linea codigo-articulo="AW7" tipo="Libro">
                <descripcion>Analítica Web 2.0</descripcion>
                <cantidad>1</cantidad>
                <oferta />
                <descuento>2.1</descuento>
                <pvp>25.12</pvp>
            </linea>
            <linea codigo-articulo="CP5" tipo="DVD">
                <descripcion>Curso de HTML</descripcion>
                <cantidad>2</cantidad>
                <pvp>30.5</pvp>
            </linea>
        </detalle-factura>
    </factura>
</facturas>